smartctl 7.2 2020-12-30 r5155 [x86_64-linux] (local build)
Copyright (C) 2002-20, Bruce Allen, Christian Franke, www.smartmontools.org

=== START OF INFORMATION SECTION ===
Model Number:                       NV5418-E3.s
Serial Number:                      ABCD4620EFGH
Firmware Version:                   D3V741VAB
PCI Vendor ID:                      0x1234
PCI Vendor Subsystem ID:            0x1182
IEEE OUI Identifier:                0x00b538
Total NVM Capacity:                 65,970,697,666,560 [66.0 TB]
Unallocated NVM Capacity:           0
Controller ID:                      0
NVMe Version:                       2.0
Number of Namespaces:               16
Namespace 1 Size/Capacity:          65,970,697,666,560 [66.0 TB]
Namespace 1 Formatted LBA Size:     512
Namespace 1 IEEE EUI-64:            0026b7 282b2ba6c5
Local Time is:                      Tue Dec 24 18:37:53 2024 MST
Firmware Updates (0x17):            3 Slots, Slot 1 R/O, no Reset required
Optional Admin Commands (0x045e):   Format Frmw_DL NS_Mngmt Self_Test MI_Snd/Rec *Other*
Optional NVM Commands (0x0057):     Comp Wr_Unc DS_Mngmt Sav/Sel_Feat Timestmp
Log Page Attributes (0x7e):         Cmd_Eff_Lg Ext_Get_Lg Telmtry_Lg Pers_Ev_Lg *Other*
Maximum Data Transfer Size:         256 Pages
Warning  Comp. Temp. Threshold:     80 Celsius
Critical Comp. Temp. Threshold:     85 Celsius
Namespace 1 Features (0x1e):        NA_Fields Dea/Unw_Error No_ID_Reuse NP_Fields

Supported Power States
St Op     Max   Active     Idle   RL RT WL WT  Ent_Lat  Ex_Lat
 0 +    25.00W   25.00W       -    0  0  0  0      100     100
 1 +    24.00W   24.00W       -    1  1  1  1       10      10
 2 +    23.00W   23.00W       -    2  2  2  2       10      10
 3 +    22.00W   22.00W       -    3  3  3  3       10      10
 4 +    21.00W   21.00W       -    4  4  4  4       10      10
 5 +    20.00W   20.00W       -    5  5  5  5       10      10
 6 +    19.00W   19.00W       -    6  6  6  6       10      10
 7 +    18.00W   18.00W       -    7  7  7  7       10      10
 8 +    17.00W   17.00W       -    8  8  8  8       10      10
 9 +    16.00W   16.00W       -    9  9  9  9       10      10
10 +    15.00W   15.00W       -   10 10 10 10       10      10
11 +    14.00W   14.00W       -   11 11 11 11       10      10
12 +    13.00W   13.00W       -   12 12 12 12       10      10
13 +    12.00W   12.00W       -   13 13 13 13       10      10

Supported LBA Sizes (NSID 0x1)
Id Fmt  Data  Metadt  Rel_Perf
 0 +     512       0         0
 1 -    4096       0         0

=== START OF SMART DATA SECTION ===
SMART overall-health self-assessment test result: PASSED

SMART/Health Information (NVMe Log 0x02)
Critical Warning:                   0x00
Temperature:                        61 Celsius
Available Spare:                    100%
Available Spare Threshold:          6%
Percentage Used:                    13%
Data Units Read:                    12220000000 [6.11 PB]
Data Units Written:                 12920000000 [6.46 PB]
Host Read Commands:                 696528594319
Host Write Commands:                646371220859
Controller Busy Time:               63585
Power Cycles:                       15
Power On Hours:                     3938
Unsafe Shutdowns:                   3
Media and Data Integrity Errors:    0
Error Information Log Entries:      0
Warning  Comp. Temperature Time:    0
Critical Comp. Temperature Time:    0
Temperature Sensor 1:               61 Celsius
Temperature Sensor 2:               58 Celsius
Temperature Sensor 3:               63 Celsius

Error Information (NVMe Log 0x01, 16 of 256 entries)
No Errors Logged
